Date,Cruise,Road,Aviation,All,Year,Month,Quarter,Period ,Data Status
1/1/2013,16000,90000,545812,651812,2013,1,1,Pre_Covid,Actual
2/1/2013,20000,88000,462476,570476,2013,2,1,Pre_Covid,Actual
3/1/2013,21000,91000,475366,587366,2013,3,1,Pre_Covid,Actual
4/1/2013,19571,90211,504137,613919,2013,4,2,Pre_Covid,Actual
5/1/2013,20403,113746,424602,558751,2013,5,2,Pre_Covid,Actual
6/1/2013,21568,100067,445656,567291,2013,6,2,Pre_Covid,Actual
7/1/2013,18947,132990,506388,658325,2013,7,3,Pre_Covid,Actual
8/1/2013,11489,139237,525993,676719,2013,8,3,Pre_Covid,Actual
9/1/2013,18578,138059,458190,614827,2013,9,3,Pre_Covid,Actual
10/1/2013,8289,142088,478318,628695,2013,10,4,Pre_Covid,Actual
11/1/2013,5658,138582,586794,731034,2013,11,4,Pre_Covid,Actual
12/1/2013,9758,146370,566221,722349,2013,12,4,Pre_Covid,Actual
1/1/2014,7642,150451,618081,776174,2014,1,1,Pre_Covid,Actual
2/1/2014,15241,179552,647233,842026,2014,2,1,Pre_Covid,Actual
3/1/2014,5658,120837,583230,709725,2014,3,1,Pre_Covid,Actual
4/1/2014,5956,133692,606332,745980,2014,4,2,Pre_Covid,Actual
5/1/2014,4781,138056,531367,674204,2014,5,2,Pre_Covid,Actual
6/1/2014,1370,101685,436721,539776,2014,6,2,Pre_Covid,Actual
7/1/2014,2000,114012,448724,564736,2014,7,3,Pre_Covid,Actual
8/1/2014,1500,97553,519535,618588,2014,8,3,Pre_Covid,Actual
9/1/2014,1800,114418,474663,590881,2014,9,3,Pre_Covid,Actual
10/1/2014,795,151004,407203,559002,2014,10,4,Pre_Covid,Actual
11/1/2014,562,115867,492188,608617,2014,11,4,Pre_Covid,Actual
12/1/2014,1287,136579,519438,657304,2014,12,4,Pre_Covid,Actual
1/1/2015,6883,131926,561883,700692,2015,1,1,Pre_Covid,Actual
2/1/2015,7021,138145,610834,756000,2015,2,1,Pre_Covid,Actual
3/1/2015,9245,70096,538554,617895,2015,3,1,Pre_Covid,Actual
4/1/2015,6142,149791,534507,690440,2015,4,2,Pre_Covid,Actual
5/1/2015,1551,116559,458758,576868,2015,5,2,Pre_Covid,Actual
6/1/2015,4113,106156,419176,529445,2015,6,2,Pre_Covid,Actual
7/1/2015,1958,83148,508460,593566,2015,7,3,Pre_Covid,Actual
8/1/2015,1360,53466,610159,664985,2015,8,3,Pre_Covid,Actual
9/1/2015,3323,144929,478072,626324,2015,9,3,Pre_Covid,Actual
10/1/2015,3980,183575,461544,649099,2015,10,4,Pre_Covid,Actual
11/1/2015,4124,205747,522869,732740,2015,11,4,Pre_Covid,Actual
12/1/2015,13728,169846,577224,760798,2015,12,4,Pre_Covid,Actual
1/1/2016,22553,133253,659394,815200,2016,1,1,Pre_Covid,Actual
2/1/2016,21887,154518,667321,843726,2016,2,1,Pre_Covid,Actual
3/1/2016,22978,147784,659846,830608,2016,3,1,Pre_Covid,Actual
4/1/2016,23697,114431,661484,799612,2016,4,2,Pre_Covid,Actual
5/1/2016,25536,97942,643894,767372,2016,5,2,Pre_Covid,Actual
6/1/2016,18910,63526,628138,710574,2016,6,2,Pre_Covid,Actual
7/1/2016,21656,94934,739849,856439,2016,7,3,Pre_Covid,Actual
8/1/2016,22656,108202,779008,909866,2016,8,3,Pre_Covid,Actual
9/1/2016,22510,130610,670015,823135,2016,9,3,Pre_Covid,Actual
10/1/2016,20446,133563,668136,822145,2016,10,4,Pre_Covid,Actual
11/1/2016,26980,141578,768221,936779,2016,11,4,Pre_Covid,Actual
12/1/2016,35046,146916,715317,897279,2016,12,4,Pre_Covid,Actual
1/1/2017,18340,153923,834975,1007238,2017,1,1,Pre_Covid,Actual
2/1/2017,71099,144309,984013,1199421,2017,2,1,Pre_Covid,Actual
3/1/2017,22615,170612,812594,1005821,2017,3,1,Pre_Covid,Actual
4/1/2017,49790,141996,879864,1071650,2017,4,2,Pre_Covid,Actual
5/1/2017,5996,119323,847525,972844,2017,5,2,Pre_Covid,Actual
6/1/2017,3003,93365,852994,949362,2017,6,2,Pre_Covid,Actual
7/1/2017,7258,122358,907264,1036880,2017,7,3,Pre_Covid,Actual
8/1/2017,1818,164116,1063229,1229163,2017,8,3,Pre_Covid,Actual
9/1/2017,9978,134833,831141,975952,2017,9,3,Pre_Covid,Actual
10/1/2017,14810,146588,863501,1024899,2017,10,4,Pre_Covid,Actual
11/1/2017,25766,142470,1004332,1172568,2017,11,4,Pre_Covid,Actual
12/1/2017,28363,219125,1028865,1276353,2017,12,4,Pre_Covid,Actual
1/1/2018,34759,244514,1150969,1430242,2018,1,1,Pre_Covid,Actual
2/1/2018,57850,228034,1145961,1431845,2018,2,1,Pre_Covid,Actual
3/1/2018,27166,247363,1068785,1343314,2018,3,1,Pre_Covid,Actual
4/1/2018,22285,250836,1068792,1341913,2018,4,2,Pre_Covid,Actual
5/1/2018,15562,196689,948863,1161114,2018,5,2,Pre_Covid,Actual
6/1/2018,16067,180816,986219,1183102,2018,6,2,Pre_Covid,Actual
7/1/2018,4078,196410,988329,1188817,2018,7,3,Pre_Covid,Actual
8/1/2018,4948,254200,1064398,1323546,2018,8,3,Pre_Covid,Actual
9/1/2018,8090,219432,985075,1212597,2018,9,3,Pre_Covid,Actual
10/1/2018,9247,242120,953790,1205157,2018,10,4,Pre_Covid,Actual
11/1/2018,4323,261535,1036051,1301909,2018,11,4,Pre_Covid,Actual
12/1/2018,10931,275549,1087755,1374235,2018,12,4,Pre_Covid,Actual
1/1/2019,24157,310406,1167203,1501766,2019,1,1,Pre_Covid,Actual
2/1/2019,30730,301338,1256093,1588161,2019,2,1,Pre_Covid,Actual
3/1/2019,20147,297073,1092967,1410187,2019,3,1,Pre_Covid,Actual
4/1/2019,44432,266567,1157767,1468766,2019,4,2,Pre_Covid,Actual
5/1/2019,10551,268249,1047868,1326668,2019,5,2,Pre_Covid,Actual
6/1/2019,9147,239928,936370,1185445,2019,6,2,Pre_Covid,Actual
7/1/2019,18458,250686,1046648,1315792,2019,7,3,Pre_Covid,Actual
8/1/2019,14159,312502,1185786,1512447,2019,8,3,Pre_Covid,Actual
9/1/2019,17824,245113,1298337,1561274,2019,9,3,Pre_Covid,Actual
10/1/2019,23686,272825,1321826,1618337,2019,10,4,Pre_Covid,Actual
11/1/2019,19140,296173,1494267,1809580,2019,11,4,Pre_Covid,Actual
12/1/2019,31684,306107,1372377,1710168,2019,12,4,Pre_Covid,Actual
1/1/2020,80092,292464,1621569,1994125,2020,1,1,Pre_Covid,Actual
2/1/2020,54993,192859,994879,1242731,2020,2,1,Pre_Covid,Actual
3/1/2020,9024,65762,375137,449923,2020,3,1,Pre_Covid,Actual
4/1/2020,435,4568,21218,26221,2020,4,2,Covid,Hypothetical
5/1/2020,377,3954,18369,22700,2020,5,2,Covid,Hypothetical
6/1/2020,146,1533,7121,8800,2020,6,2,Covid,Hypothetical
7/1/2020,231,2421,11248,13900,2020,7,3,Covid,Hypothetical
8/1/2020,271,2839,13190,16300,2020,8,3,Covid,Hypothetical
9/1/2020,229,2404,11167,13800,2020,9,3,Covid,Hypothetical
10/1/2020,246,2578,11976,14800,2020,10,4,Covid,Hypothetical
11/1/2020,294,3083,14323,17700,2020,11,4,Covid,Hypothetical
12/1/2020,271,2839,13190,16300,2020,12,4,Covid,Hypothetical
1/1/2021,247,2698,14792,17736,2021,1,1,Covid,Hypothetical
2/1/2021,153,1673,9174,11000,2021,2,1,Covid,Hypothetical
3/1/2021,270,2951,16180,19400,2021,3,1,Covid,Hypothetical
4/1/2021,271,2966,16263,19500,2021,4,2,Covid,Hypothetical
5/1/2021,186,2038,11176,13400,2021,5,2,Covid,Hypothetical
6/1/2021,100,1095,6005,7200,2021,6,2,Covid,Hypothetical
7/1/2021,104,1141,6255,7500,2021,7,3,Covid,Hypothetical
8/1/2021,129,1415,7756,9300,2021,8,3,Covid,Hypothetical
9/1/2021,132,1445,7923,9500,2021,9,3,Covid,Hypothetical
10/1/2021,147,1612,8840,10600,2021,10,4,Covid,Hypothetical
11/1/2021,208,2282,12510,15000,2021,11,4,Covid,Hypothetical
12/1/2021,239,2616,14345,17200,2021,12,4,Covid,Hypothetical
1/1/2022,10,2356,17361,19727,2022,1,1,Post_Covid,Actual
2/1/2022,18,3624,25875,29517,2022,2,1,Post_Covid,Actual
3/1/2022,8,2649,39083,41740,2022,3,1,Post_Covid,Actual
4/1/2022,28,13309,88036,101373,2022,4,2,Post_Covid,Actual
5/1/2022,31,22561,150356,172948,2022,5,2,Post_Covid,Actual
6/1/2022,29,33462,203186,236677,2022,6,2,Post_Covid,Actual
7/1/2022,133,45319,307127,352579,2022,7,3,Post_Covid,Actual
8/1/2022,130,46749,439528,486407,2022,8,3,Post_Covid,Actual
9/1/2022,107,42448,389354,431909,2022,9,3,Post_Covid,Actual
10/1/2022,251,50352,433752,484355,2022,10,4,Post_Covid,Actual
11/1/2022,110,63265,533544,596919,2022,11,4,Post_Covid,Actual
12/1/2022,2284,54838,649949,707071,2022,12,4,Post_Covid,Actual
1/1/2023,5645,65456,800061,871162,2023,1,1,Post_Covid,Actual
2/1/2023,7356,89413,836200,932969,2023,2,1,Post_Covid,Actual
3/1/2023,20707,87046,787672,895425,2023,3,1,Post_Covid,Actual
4/1/2023,10338,130959,842849,984146,2023,4,2,Post_Covid,Actual
5/1/2023,6828,130362,779067,916257,2023,5,2,Post_Covid,Actual
6/1/2023,4167,130253,840590,975010,2023,6,2,Post_Covid,Actual
7/1/2023,16,131846,906701,1038563,2023,7,3,Post_Covid,Actual
8/1/2023,4620,144385,1068416,1217421,2023,8,3,Post_Covid,Actual
9/1/2023,4349,136176,913924,1054449,2023,9,3,Post_Covid,Actual
10/1/2023,5426,138005,969095,1112526,2023,10,4,Post_Covid,Actual
11/1/2023,18413,153392,1061566,1233371,2023,11,4,Post_Covid,Actual
12/1/2023,38222,188505,1144408,1371135,2023,12,4,Post_Covid,Actual
1/1/2024,48376,176910,1287027,1512313,2024,1,1,Post_Covid,Actual
2/1/2024,42312,211719,1277380,1531411,2024,2,1,Post_Covid,Actual
3/1/2024,45991,236640,1316443,1599074,2024,3,1,Post_Covid,Actual
4/1/2024,14872,231645,1310016,1556533,2024,4,2,Post_Covid,Actual
5/1/2024,10868,220370,1152465,1383703,2024,5,2,Post_Covid,Actual
6/1/2024,2430,183541,1063266,1249237,2024,6,2,Post_Covid,Actual
7/1/2024,694,148726,1002012,1151432,2024,7,3,Post_Covid,Actual
8/1/2024,48,180441,1266320,1446809,2024,8,3,Post_Covid,Actual
9/1/2024,59,168612,1106133,1274804,2024,9,3,Post_Covid,Actual
10/1/2024,23437,202833,1193563,1419833,2024,10,4,Post_Covid,Actual
11/1/2024,32078,277542,1401892,1711512,2024,11,4,Post_Covid,Actual
12/1/2024,26885,252752,1467603,1747240,2024,12,4,Post_Covid,Actual
1/1/2025,44915,228411,1797140,2070466,2025,1,1,Post_Covid,Actual
1/2/2025,54449,238805,1600679,1893933,2025,2,1,Post_Covid,Actual
1/3/2025,33665,218292,1802352,2054309,2025,3,1,Post_Covid,Actual
1/4/2025,25298,239356,1390027,1654681,2025,4,2,Post_Covid,Actual
1/5/2025,17114,259669,1251269,1528052,2025,5,2,Post_Covid,Actual
1/6/2025,5914,213141,1243812,1462867,2025,6,2,Post_Covid,Actual
1/7/2025,2518,234729,1325341,1562588,2025,7,3,Post_Covid,Actual
1/8/2025,3909,23484,1446223,1684972,2025,8,3,Post_Covid,Actual
1/9/2025,2848,232788,1287752,1523388,2025,9,3,Post_Covid,Actual
1/10/2025,14475,281776,1436691,1732942,2025,10,4,Post_Covid,Actual
1/11/2025,2367,35406,1600444,1978174,2025,11,4,Post_Covid,Actual
1/12/2025,45172,318035,1658412,2021619,2025,12,4,Post_Covid,Actual
1/1/2026,35980,209122,1848221,2093322,2026,1,1,Post_Covid,Forecast
1/2/2026,45519,241728,1794729,2081976,2026,2,1,Post_Covid,Forecast
1/3/2026,37150,208624,1769647,2015421,2026,3,1,Post_Covid,Forecast
1/4/2026,23661,245873,1482531,1752065,2026,4,2,Post_Covid,Forecast
1/5/2026,15872,258564,1345973,1620408,2026,5,2,Post_Covid,Forecast
1/6/2026,5822,198332,1203876,1408030,2026,6,2,Post_Covid,Forecast
1/7/2026,1556,225048,1370295,1596898,2026,7,3,Post_Covid,Forecast
1/8/2026,5418,106637,1597402,1843719,2026,8,3,Post_Covid,Forecast
1/9/2026,4685,240188,1433248,1678122,2026,9,3,Post_Covid,Forecast
1/10/2026,12352,260548,1493216,1766117,2026,10,4,Post_Covid,Forecast
1/11/2026,13296,120800,1703247,2054859,2026,11,4,Post_Covid,Forecast
1/12/2026,52545,319164,1766018,2137727,2026,12,4,Post_Covid,Forecast
